{
  "schema_version": "1.0.0",
  "scenario": {
    "id": "physics/resting-stack-100",
    "description": "Advance a deterministic resting stack after a small state change.",
    "workload": {
      "id": "resting-stack-100",
      "hash": "sha256:1111111111111111111111111111111111111111111111111111111111111111",
      "seed": 42,
      "parameters": {
        "body_count": 100,
        "steps": 120
      }
    }
  },
  "source": {
    "repository": "https://github.com/example/physics-engine",
    "revision": "0123456789abcdef0123456789abcdef01234567",
    "dirty": false
  },
  "environment": {
    "fingerprint": "sha256:2222222222222222222222222222222222222222222222222222222222222222",
    "platform": {
      "os": "linux",
      "arch": "x86_64"
    },
    "toolchain": {
      "rustc": "1.x",
      "collector": "example"
    },
    "collector": {
      "name": "performance-evidence-example",
      "version": "0.1.0"
    }
  },
  "measurements": {
    "useful_work": [
      {
        "name": "physics.changed_bodies",
        "value": 8,
        "unit": "count",
        "measurement_type": "counter"
      }
    ],
    "induced_work": [
      {
        "name": "physics.body_visits",
        "value": 126,
        "unit": "count",
        "measurement_type": "counter"
      },
      {
        "name": "memory.bytes_copied",
        "value": 9216,
        "unit": "byte",
        "measurement_type": "size"
      },
      {
        "name": "cpu.instructions",
        "value": 1820341,
        "unit": "instruction",
        "measurement_type": "counter"
      }
    ],
    "outcomes": [
      {
        "name": "time.elapsed",
        "value": 584000,
        "unit": "ns",
        "measurement_type": "duration"
      }
    ]
  },
  "artifacts": [
    {
      "kind": "callgrind",
      "path": "artifacts/resting-stack.callgrind",
      "sha256": "sha256:3333333333333333333333333333333333333333333333333333333333333333",
      "media_type": "application/octet-stream"
    }
  ]
}
